authors	url (pdf)	licence	title	keywords
Dunst, Alexander; Hartel, Rita	https://dh2017.adho.org/abstracts/047/047.pdf	cc-by	Corpora and Complex Networks as Cultural Critique: Investigating Race and Gender Bias in Graphic Narratives	Comics, networks, cultural studies, gender
Dury, Christian	https://dh2017.adho.org/abstracts/644/644.pdf	cc-by	Séance d&#8217;initiation à la vidéo adaptée à la recherche SHS	image animée-video-captation-tournage-montage
Dussault, Jessica; Weakly, Laura; Dalziel, Karin; Echols, Jeremy; Estlund, Karen M.; Gearhart, Andrew; Rabun, Sheila; Tunink, Greg	https://dh2017.adho.org/abstracts/211/211.pdf	cc-by	Introducing the Open Online Newspaper Initiative	newspapers, open source software, digitization, image server, collaboration
Earhart, Amy; Jones, Steven; McPherson, Tara; Ray Murray, Padmini; Whitson, Roger	https://dh2017.adho.org/abstracts/115/115.pdf	cc-by	Alternate Histories of the Digital Humanities	alternate history, media archaeology, fandom, activism, decolonization
Eder, Maciej	https://dh2017.adho.org/abstracts/341/341.pdf	cc-by	Short Samples in Authorship Attribution: A New Approach	authorship attribution, stylometry, sample size, short samples, reliability
Engel, Maureen; Aghilidehkordi, Bamdad; Clafin, Kaitlyn; Stang, Michaela; Tanner, Nailisa	https://dh2017.adho.org/abstracts/387/387.pdf	cc-by	Go Queer: Producing Queer Place with Locative Media	Locative, Queer, History, Place, App
Escobar Varela, Miguel; Hernández Barraza, Luis Carlos	https://dh2017.adho.org/abstracts/279/279.pdf	cc-by	Augmented dance scholarship: computer-assisted analysis of Javanese dance	Dance, Biomechanics, Indonesia
Estill, Laura	https://dh2017.adho.org/abstracts/019/019.pdf	cc-by	Making Manuscripts Searchable: DEx: A Database of Dramatic Extracts, Digital Publication, and Boutique Projects	drama, shakespeare, TEI, digital publication
Fadili, Hammou; Ouguenoun, Ahcène	https://dh2017.adho.org/abstracts/124/124.pdf	cc-by	Une approche de conception collaborative et d’exploitation des modèles ontologiques des données, facilement extensibles et compatibles avec le Web des Données Ouvertes (LOD) pour les Humanités Numériques (DH)	modèles des données, ontologies, données intelligentes, humanités numériques, web des données
Fargier, Nathalie	https://dh2017.adho.org/abstracts/155/155.pdf	cc-by	From the Editorial Chain to the Research Platform: Structuring, Enriching and Publishing Large Collections of Digitized Scientific Publications	plateforme numérique, patrimoine scientifique, open access, linked open data
Fenlon, Katrina Simone	https://dh2017.adho.org/abstracts/434/434.pdf	cc-by	Toward A Typology Of Digital Thematic Research Collections	thematic research collections, typology, data modeling, scholarly communication
Fields, Paul J.; Bassist, Larry; Roper, Matt	https://dh2017.adho.org/abstracts/494/494.pdf	cc-by	Characters in 19th Century Novels Display Distinctive Voices as Seen by Stylometric Analysis	Stylometry, Character Voice, Austen Dickens, Cooper, Twain
Figueira, Luís; Vieira, Miguel	https://dh2017.adho.org/abstracts/091/091.pdf	cc-by	Modelling a Prosopography for the Roman Republic	prosopography, modelling, roman, visualisation
Fischer, Frank; Göbel, Mathias; Kampkaspar, Dario; Kittel, Christopher; Trilcke, Peer	https://dh2017.adho.org/abstracts/071/071.pdf	cc-by	Network Dynamics, Plot Analysis: Approaching the Progressive Structuration of Literary Texts	Plot Analysis, Network Analysis, Dynamic Networks, Digital Literary Studies
Fitzmaurice, Susan; Alexander, Marc; Robinson, Justyna; Pidd, Michael; Hine, Iona; Mehl, Seth; Dallachy, Fraser; Groves, Matthew; Rogers, Kathryn; Aitken, Brian	https://dh2017.adho.org/abstracts/016/016.pdf	cc-by	The Seven Words of the Virgin: Identifying change in the discourse context of the concept of virginity in Early Modern English	concept, semantics, Early Modern English, virginity
Folsom, Jamie; Bastien, Pascal; Ravel, Jeffrey; Harvey, Sara; Puget, Julien; Deruelle, Benjamin	https://dh2017.adho.org/abstracts/648/648.pdf	cc-by	The Design of Historical Data Projects. Les Registres de la Comédie Française, and Le Laboratoire Paris XVIII	Data, API, Linked Open Data, GIS, History, France, Access, Preservation, Database Design, Information Architecture
Forcier, Eric	https://dh2017.adho.org/abstracts/046/046.pdf	cc-by	Re(a)d Wedding: A Comparative Discourse Analysis of Fan Responses to Game of Thrones	popular culture, adaptation, transmedia, game of thrones, fans, fan studies
Forest, Dominic; Truong, Vinh; Yvon, Lemay	https://dh2017.adho.org/abstracts/555/555.pdf	cc-by	De quoi est-il question dans le discours en art contemporain? La fouille de textes appliquée à l’art contemporain dans les centres d’artistes	Fouille de textes, topic modeling, art contemporain, artspeak, distant viewing
Fornaro, Peter R.; Bianco, Andrea; Kaiser, Aeneas; Rosenthaler, Lukas; Schmitt, Lother; Feldmann, Heidrun	https://dh2017.adho.org/abstracts/151/151.pdf	cc-by	Enhanced RTI for Arts and Humanities	Reflection Transformation Imaging, Virtual Research Environment, Digital Materials
Fornes, Alicia; Megyesi, Beáta; Mas, Joan	https://dh2017.adho.org/abstracts/228/228.pdf	cc-by	Transcription of Encoded Manuscripts with Image Processing Techniques	image processing, hand-written manuscripts, automatic transcription, historical cryptology
Foster, Caroline; Hayward, Adam; Kucheryavykh, Svyatoslav; Vujic, Angela; Japra, Maninder; Negi, Shivani; Klein, Lauren F.	https://dh2017.adho.org/abstracts/146/146.pdf	cc-by	The Shape of History: Reimagining Nineteenth-Century Data Visualization	visualization, historical fabrication, physical computing, speculative design
France, Fenella G.; Campagnolo, Alberto	https://dh2017.adho.org/abstracts/508/508.pdf	cc-by	Integrating Humanities and Science: the Scriptospatial Visualization Interface	Scriptospatial, spectral imaging, data visualization, cultural heritage
Franzini, Emily; Büchler, Marco	https://dh2017.adho.org/abstracts/301/301.pdf	cc-by	From Jane Austen’s original Pride and Prejudice to a graded reader for L2 learners: a computational study of the processes of text simplification	simplification, graded-reader, novel, text-reuse, difference-anlysis
Franzini, Greta; Büchler, Marco	https://dh2017.adho.org/abstracts/379/379.pdf	cc-by	Orosius’ Histories: A Digital Intertextual Investigation Into The First Christian History Of Rome	Latin, Text Reuse, Big Data, Public Domain, Open Source
Fredner, Erik; McClure, David; Porter, JD	https://dh2017.adho.org/abstracts/574/574.pdf	cc-by	Reading the Norton Anthologies: Databases, Canons, and “Careers”	norton, anthology, literature, canon
GOTO, Makoto; SHIBUTANI, Ayako	https://dh2017.adho.org/abstracts/290/290.pdf	cc-by	Information Infrastructure of Linked Data for Promoting Integrated Studies of Cultural and Research Resources	Linked Data, IIIF, Museum and Historical Research Database
Gao, Jin; Duke-Williams, Oliver; Mahony, Simon; Ramdarshan Bold, Melanie; Nyhan, Julianne	https://dh2017.adho.org/abstracts/083/083.pdf	cc-by	The Intellectual Structure of Digital Humanities: An Author Co-Citation Analysis	co-citation analysis, digital humanities, intellectrual structure, citation network
Gervais, Bertrand; Marcotte, Sophie; Bordeleau, Benoit; Cortopassi, Gina; Tronca, Lisa; Tremblay, Alexandra	https://dh2017.adho.org/abstracts/632/632.pdf	cc-by	Thème: Imaginaires et pratiques de la culture mobile	Mobile platforms as exhibition spaces; Writing and reading practices in a digital context; Literary itineraries and urban imaginaries; Creative hijacking of big data; Online representation of marginalized communities.
Giannella, Julia; Velho, Luiz	https://dh2017.adho.org/abstracts/558/558.pdf	cc-by	ObservatóR!O2016	Olympic Games, Visual Big Data, Computer vision, Deep Learning, Visualization
Gladstone, Clovis; Cooney, Charles; Allen, Tim	https://dh2017.adho.org/abstracts/442/442.pdf	cc-by	What&#8217;s in a word? Exploring words and their usage in the &#8220;Dictionnaire Vivant de la Langue Française&#8221;	Dictionary, lexicography, collocations, word embeddings
Gniady, Tassie; Wernert, Eric	https://dh2017.adho.org/abstracts/544/544.pdf	cc-by	An Open, Reproducible Method for Teaching Text Analysis with R	R, text analysis, repeatable workflows, visualization
Goddard, Lisa	https://dh2017.adho.org/abstracts/231/231.pdf	cc-by	Negotiating Sustainability: The Grant Services “Menu&#8221; at UVic Libraries	sustainability, curation, scholarly communication, digital preservation, grant services
Gold, Matthew K.; French, Scot; Spiro, Lisa; Kaufman, Micki; Glass, Erin; Rhody, Lisa; Huet, Hélène	https://dh2017.adho.org/abstracts/284/284.pdf	cc-by	Building Space for DH Communities	community, commons, communication, collaboration, representation
González-Blanco, Elena; Del Rio, Gimena; Martínez, Clara	https://dh2017.adho.org/abstracts/429/429.pdf	cc-by	Using e-learning systems for DH teaching: the Spanish Humanidades Digitales case study at LINHD	digital humanities curriculum, e-learning, DH pedagogoy, Spanish, virtual, online
Gooding, Paul Matthew	https://dh2017.adho.org/abstracts/070/070.pdf	cc-by	&#8220;A Trace of this Journey&#8221;: Citations of Digitised Newspapers in UK History PhD Theses	digitisation, newspapers, citations, text mining
Goodrich, Andre; Templehoff, Gustaf; Steyn, Juan	https://dh2017.adho.org/abstracts/470/470.pdf	cc-by	Site-specific Cultural Infrastructure: Promoting Access And Conquering The Digital Divide.	access, emerging technologies, multicultural, infrastructure
Graham, Elyse; Crease, Robert	https://dh2017.adho.org/abstracts/026/026.pdf	cc-by	Designing Tools for Macro-Scale Data Analysis in the History of Science	history, history of science, databases
Grandjean, Martin	https://dh2017.adho.org/abstracts/202/202.pdf	cc-by	Multimode and Multilevel: Vertical Dimension in Historical and Literary Networks	networks, social network analysis, data visualization
Grandjean, Martin	https://dh2017.adho.org/abstracts/527/527.pdf	cc-by	Médias Sociaux et Mise en Scène de l’Histoire	Twitter, media studies, digital studies
Grandjean, Martin; Benz, Pierre; Rossier, Thierry	https://dh2017.adho.org/abstracts/201/201.pdf	cc-by	Complex Network Visualisation for the History of Interdisciplinarity: Mapping 40 years of Science Funding in Switzerland	networks, history of science, database, scientometry
Green, Alex; Kaplish, Lalita; Walker, Hannah	https://dh2017.adho.org/abstracts/572/572.pdf	cc-by	New potentials in the digital archives: a participative inquiry into interdisciplinary collaboration in digital historical research at the Wellcome Trust	collaboration, experimentation, innovation
Green, Harriett Elizabeth; Senseney, Megan; Bonn, Maria	https://dh2017.adho.org/abstracts/435/435.pdf	cc-by	Collaborations in the Global Midwest: The Diffusion of DH Values in Research Collaborations in the Humanities Without Walls consortium	research practices, collaborations, digital publishing, interdisciplinary research
Greenspan, Brian	https://dh2017.adho.org/abstracts/328/328.pdf	cc-by	Dazzle them with Baffles: Gauging Attitudes toward Digital Fabrication in an Online Musicians’ Community	3D Printing, musical instruments, audio analysis, social media, sentiment analysis
Greenspan, Brian	https://dh2017.adho.org/abstracts/557/557.pdf	cc-by	Expo &#8217;27: Designing and User-Testing a Dystopian Augmented Reality Game	Montreal, AR, mobile gaming, technoculture, dystopia
Griggs, Hannah C.	https://dh2017.adho.org/abstracts/244/244.pdf	cc-by	Mapping Prohibition: The Challenges of Digitally (Re)creating Historical Spaces	public history, visualization, New Orleans, mapping, print culture
Grossner, Karl; Berman, Merrick Lex; Simon, Rainer	https://dh2017.adho.org/abstracts/204/204.pdf	cc-by	Linked Places: A Modeling Pattern and Software for Representing Historical Movement	data modeling, ontologies, geographic movement, geographic networks
Guiliano, Jennifer; Heitman, Carolyn	https://dh2017.adho.org/abstracts/372/372.pdf	cc-by	Indigenizing the Digital Humanities: Challenges, Questions, and Research Opportunities	Native American, Indigenous, Open Access, Tribal
Gutiérrez De la Torre, Silvia Eunice; Equihua Benítez, Julián Alberto; Chávez Villa, Micaela	https://dh2017.adho.org/abstracts/446/446.pdf	cc-by	Los Hilos De Ariadna En El Laberinto Temático: Visualización Y Minado De Datos Para Bibliotecas	data mining, data science, metadata, libraries, data visualisation
Hammond, Adam; Brooke, Julian	https://dh2017.adho.org/abstracts/388/388.pdf	cc-by	GutenTag: A User-Friendly, Open-Access, Open-Source System for Reproducible Large-Scale Computational Literary Analysis	distant reading, tools, corpora, reproducibility, sex and gender
Hankins, Gabriel Anderson; Elavsky, Frank	https://dh2017.adho.org/abstracts/594/594.pdf	cc-by	“Comparing Correspondences: Robert Southey and Willa Cather”	correspondence, visualization, metadata, graphs, networks
Hanna, Fabiola	https://dh2017.adho.org/abstracts/536/536.pdf	cc-by	A Case Study of Automated Curation of Digital Archives	software studies, digital humanities, archives, new media art, video
Harbers, Frank; Lonij, Juliette	https://dh2017.adho.org/abstracts/206/206.pdf	cc-by	Distinguishing Newspaper Genres. Exploring Automated Classification of Journalism’s Modes of Expression	Automatic Genre Classification, Historical Newspapers, Machine Learning, Digital Newspaper Archives
Hardy, Molly; Childress, Dawn; Morgan, Paige	https://dh2017.adho.org/abstracts/430/430.pdf	cc-by	Beyond Access: Critical Catalog Constructions	cataloging, bibliography, metadata, information architecture, book history
Hayward, Nicholas John	https://dh2017.adho.org/abstracts/624/624.pdf	cc-by	A Cor infrastructure for textual analysis &#8211; From Woolf to Verne	verne, computer science
Hechtl, Angelika; Börner, Ingo; Fischer, Frank; Trilcke, Peer	https://dh2017.adho.org/abstracts/506/506.pdf	cc-by	Cäsar Flaischlen’s “Graphische Litteratur-Tafel” &#8211; Digitizing A Giant Historical Flowchart Of Foreign Influences On German Literature	literary map, TEI, data visualization, german literary history, history of DH
Hellrich, Johannes; Hahn, Udo	https://dh2017.adho.org/abstracts/487/487.pdf	cc-by	Don’t Get Fooled by Word Embeddings—Better Watch their Neighborhood	word embeddings, reliability, word2vec, distributional semantics
Hench, Christopher Leo	https://dh2017.adho.org/abstracts/141/141.pdf	cc-by	Prosodic Clustering via Cosine Similarity of Sound Sequence Inventories	prosody, authorship, syllables, meter, german
Heuser, Ryan James	https://dh2017.adho.org/abstracts/582/582.pdf	cc-by	Word Vectors in the Eighteenth Century	word vectors, word2vec, distant reading, cultural analytics, eighteenth century
Hicks, Benjamin Wesley	https://dh2017.adho.org/abstracts/453/453.pdf	cc-by	Mapping Pliny Social Network: A Case Study in Digital Prosopography	Pliny, social network analysis, prosopography, Roman History
Hiebert, Matthew; Lässig, Simone; Witt, Andreas	https://dh2017.adho.org/abstracts/607/607.pdf	cc-by	German History-Digital: Platform for Transnational Historical Knowledge Co-creation	repository, knowledge creation, history, infrastructure
Hinrichs, Uta; Forlini, Stefania	https://dh2017.adho.org/abstracts/133/133.pdf	cc-by	In Defence of Sandcastles: Research Thinking Through Visualization In DH	information visualization, research-through-design, interdisciplinary processes, DH tools, literary studies
Hladík, Radim	https://dh2017.adho.org/abstracts/549/549.pdf	cc-by	Topics and genre changes in Czech sociological articles	sociology, academic writing, genre, disciplines, rhetoric of science
Holmes, Martin; Takeda, Joey	https://dh2017.adho.org/abstracts/140/140.pdf	cc-by	Beyond Validation: Using Programmed Diagnostics to Learn About, Monitor, and Successfully Complete Your DH Project	digital edition, validation, diagnostics, referential integrity, project management
Homburg, Timo	https://dh2017.adho.org/abstracts/139/139.pdf	cc-by	POSTagging and Semantic Dictionary Creation for Hittite Cuneiform	Hittite, Cuneiform, Dictionary, POSTagging, Semantic Web
Hoover, Polly Ruth	https://dh2017.adho.org/abstracts/207/207.pdf	cc-by	Digital Access as an Equity Issue: The Community College and the Digital Divide	access communitycollege equity pedagogy institutionalinfrastructure
Houston, Natalie M	https://dh2017.adho.org/abstracts/479/479.pdf	cc-by	Measuring Canonicity: a Network Analysis Approach to Poetry Anthologies	network, citation, poetry, anthology
Hu, Tao; Zeng, Marcia; Zhang, Yin; Ye, Xinyue; Li, Hongshan	https://dh2017.adho.org/abstracts/571/571.pdf	cc-by	Spatial-temporal Variation based Innovation History Visualization: A Case Study of the Liquid Crystal Institute at Kent State University	Liquid Crystal, Innovation, spatial-temporal, network analysis, visualization
Huitfeldt, Claus; Sperberg-McQueen, Michael	https://dh2017.adho.org/abstracts/235/235.pdf	cc-by	Transcriptional Implicature: Using a Transcript to Reason about an Exemplar	transcription, logic, document identity, formal models
Hulden, Vilja	https://dh2017.adho.org/abstracts/597/597.pdf	cc-by	Add Slander and Stir: Reprinting of Anti-Labor Stories in Early-Twentieth-Century American Newspapers	newspapers, reprint detection, labor history
Hyman, Christy; Shrout, Anelise; Kaczmarek-Frew, Kathryn; Green, Hilary; Frazier, Nishani; Rosenblum, Brian	https://dh2017.adho.org/abstracts/233/233.pdf	cc-by	Decolonizing Methodologies: Recovery and Access Amidst the Ruins	recovery, subaltern, alternate reality games, spatial analysis, digital collections
Höhn, Winfried; Schommer, Christoph	https://dh2017.adho.org/abstracts/528/528.pdf	cc-by	RAT 2.0	Image Processing, Historical Maps, HCI, Convolutional Neural Networks
Höhn, Winfried; Schommer, Christoph	https://dh2017.adho.org/abstracts/613/613.pdf	cc-by	Georeferencing of Place Markers in Digitized Early Maps by Using Similar Maps as Data Source	Early Maps, Georeferencing, Automation
Iannozzi, Michael Anthony	https://dh2017.adho.org/abstracts/448/448.pdf	cc-by	A Seat At &#8220;La Tawola&#8221;	Italian, Immigration, Heritage, Community, Archive
Impett, Leonardo Laurence; Süsstrunk, Sabine	https://dh2017.adho.org/abstracts/525/525.pdf	cc-by	From Mnemosyne To Terpsichore &#8211; The Bilderatlas After The Image	Warburg, Bilderatlas, Human Pose, Gesture
Isaksen, Leif; Simon, Rainer; Barker, Elton T. E.	https://dh2017.adho.org/abstracts/570/570.pdf	cc-by	Social Semantic Annotation with Recogito 2	Linked Open Data, Semantic Annotation, tools, geospatial technologies
Jacobs, Hannah L.	https://dh2017.adho.org/abstracts/397/397.pdf	cc-by	Points, Lines, Polygons, and Pixels: A Framework for Teaching &amp; Learning Humanities through Visualization	pedagogy, visualization, digital literacy
Jannidis, Fotis; Pielström, Steffen; Schöch, Christof; Vitt, Thorsten	https://dh2017.adho.org/abstracts/411/411.pdf	cc-by	Making topic modeling easy. A programming library in Python	topic modeling, text analysis, python
Jean-Caurant, Axel; Suire, Cyrille; Courboulay, Vincent; Burie, Jean-Christophe	https://dh2017.adho.org/abstracts/183/183.pdf	cc-by	Limiter L&#8217;Impact Des Erreurs OCR Sur Les Représentations Distribuées De Mots	word embeddings, post-OCR error correction
Jenstad, Janelle Auriol; Landels-Gruenewald, Tye; Takeda, Joseph	https://dh2017.adho.org/abstracts/461/461.pdf	cc-by	Mapping the STC with MoEML and DEEP	Book trade, mapping, data mining, curation, databases, relational data
John, Markus; Richter, Christian; Koch, Steffen; Kuczera, Andreas; Ertl, Thomas	https://dh2017.adho.org/abstracts/313/313.pdf	cc-by	Interactive Visual Exploration of the Regesta Imperii	Digital Humanites, Interactive Visualization
Johnsen, Lars Gunnarsønn	https://dh2017.adho.org/abstracts/566/566.pdf	cc-by	Body parts in Norwegian books	body, ngrams, trends, gender
Johnsrud, Brian Charles	https://dh2017.adho.org/abstracts/249/249.pdf	cc-by	Finding ‘the Reader’ in Literary Criticism and the Reception of Contemporary Literature	reception, reader, audience, qualitative coding, annotation
Johnsrud, Brian Charles; Bush, Daniel Marle; Widner, Michael	https://dh2017.adho.org/abstracts/415/415.pdf	cc-by	Digital Annotation for Social and Collaborative Learning in the Humanities Classroom	annotation, pedagogy, learning, social, collaborative
Jones, Steven; Nyhan, Julianne; Rockwell, Geoffrey; Sinclair, Stéfan; Terras, Melissa	https://dh2017.adho.org/abstracts/042/042.pdf	cc-by	Reverse Engineering the First Humanities Computing Center	history of technology, media archaeology, digitization, modeling
Juola, Patrick; Vinsick, Sean	https://dh2017.adho.org/abstracts/210/210.pdf	cc-by	Personality and Politics: Myers-Briggs Personality Types on Twitter in the US 2016 Presidential Election	authorship profiling, demographics, social media, personality
Jänicke, Stefan	https://dh2017.adho.org/abstracts/003/003.pdf	cc-by	On the Impact of the Merseburg Incantations	Merseburg Incantations, magic spells, citation collection, visual exploration system
Jänicke, Stefan; Focht, Josef	https://dh2017.adho.org/abstracts/002/002.pdf	cc-by	Untangling the Social Network of Musicians	Social Network, Interactive Visual Exploration, Musicians&#8217; Biographies, Bayerisches Musiker Lexikon Online
Kameda, Akihiro; Hara, Shoichiro	https://dh2017.adho.org/abstracts/619/619.pdf	cc-by	Constructing Linked Knowledge around Southeast Asian Studies	Linked Open Data, Area Studies
Kapitan, Katarzyna Anna	https://dh2017.adho.org/abstracts/342/342.pdf	cc-by	Network analysis of the manuscript context of Old Icelandic literature	network analysis, Nordic philology, manuscript studies, stylometry, data mining
Karadkar, Unmil; Davis, King	https://dh2017.adho.org/abstracts/687/687.pdf	cc-by	Digital Scholarship and Privacy-sensitive Collections	privacy-sensitive collections, vulnerable populations, digital scholarship, access, ethical and legal issues
Karlin, Jojo; Smyth, Patrick; Zweibel, Stephen; Gold, Matthew K.	https://dh2017.adho.org/abstracts/280/280.pdf	cc-by	DH Box:	pedagogy, infrastructure, virtual computer, cloud, tools
Kaufman, Micki	https://dh2017.adho.org/abstracts/420/420.pdf	cc-by	&#8220;We Have This Space Problem:&#8221; Big Data, Multi-Dimensionality and the Kissinger Correspondence	sonification, three-dimensionality, visualization, text analysis, declassification
Kaufman, Micki; LeBlanc, Zoe; Lincoln, Matthew; Rochat, Yannick; Weingart, Scott B.	https://dh2017.adho.org/abstracts/428/428.pdf	cc-by	Visualizing Futures of Networks in Digital Humanities Research	networks, visualization, interdisciplinary, simulation, interactivity
Kawase, Akihiro	https://dh2017.adho.org/abstracts/116/116.pdf	cc-by	Regional Classification of Traditional Japanese Folk Songs from Southwest Regions	Japanese folk songs, tetrachord theory, data mining
Keegan, Tom; Bond, Sarah	https://dh2017.adho.org/abstracts/622/622.pdf	cc-by	Quotidian Reading: Digitally Mapping Literary and Personal Geographies	pedagogy, mapping, literature
Kemman, Max	https://dh2017.adho.org/abstracts/472/472.pdf	cc-by	Unpacking Collaboration in Digital History Projects	trading zone, digital history, collaboration, incentives, boundary object
Kestemont, Mike; Stronks, Els; de Bruin, Martine; de Winkel, Tim	https://dh2017.adho.org/abstracts/079/079.pdf	cc-by	Did a Poet with Donkey Ears Write the Oldest Anthem in the World? Ideological Implications of the Computational Attribution of the Dutch National Anthem to Petrus Dathenus	Wilhelmus, Anthem, Authorship, Petrus Dathenus, Cultural Ideology
Kestemont, Mike; Stutzmann, Dominique	https://dh2017.adho.org/abstracts/078/078.pdf	cc-by	Script Identification in Medieval Latin Manuscripts Using Convolutional Neural Networks	Machine learning, Computer vision, Digital Paleography, Deep Learning, Manuscript studies
Ketzan, Erik; Schöch, Christof	https://dh2017.adho.org/abstracts/317/317.pdf	cc-by	What Changed When Andy Weir’s The Martian Got Edited?	textual variants, editing, contemporary literature
Kim, Evgeny; Pado, Sebastian; Klinger, Roman	https://dh2017.adho.org/abstracts/203/203.pdf	cc-by	Prototypical Emotion Developments in Adventures, Romances, and Mystery Stories	emotion analysis, literary genres, distant reading
Kim, Minhyoung	https://dh2017.adho.org/abstracts/517/517.pdf	cc-by	The Useful Past and an Access to the Future: Designing a Community-Based Archive of the Korean Diaspora	Korean Diaspora, Community-Based Archive, Collective Identity, Knowledge Mapping, Community-Owned Space
King, Lindsay; Leonard, Peter	https://dh2017.adho.org/abstracts/036/036.pdf	cc-by	Transforming Theater History through Crowdsourced Transcription	crowdsourcing, theater, history, archives, special collections
Király, Péter	https://dh2017.adho.org/abstracts/458/458.pdf	cc-by	Measuring completeness as metadata quality metric in Europeana	Metadata Quality Assessment, Cultural Analytics, Big Data, Data Science
Kitamoto, Asanobu	https://dh2017.adho.org/abstracts/170/170.pdf	cc-by	MemoryGraph: Digital Critique of Old Photographs Using a Mobile App that Enhances the Interpretation of Landscape	memorygraph, digital critique, old photograph, historical studies, mobile app
Kleinman, Scott; LeBlanc, Mark	https://dh2017.adho.org/abstracts/054/054.pdf	cc-by	Lexos: An Integrated Lexomics Workflow	Lexomics, stylometry, interdisciplinary
Kleppe, Martijn; Lincoln, Matthew; Wevers, Melvin; Williams, Mark; Seguin, Benoit; Smits, Thomas	https://dh2017.adho.org/abstracts/639/639.pdf	cc-by	Computer Vision in Digital Humanities	computer vision, visual datasets, patterns, deep learning, convolutional neural networks
Kotch, Seth; Gaddis, Elijah	https://dh2017.adho.org/abstracts/365/365.pdf	cc-by	“A Pale Reflection of the Violent Truth? Practice and Pedagogy with a Digital Geography of American Lynching”	lynching, pedagogy, social justice, mapping, race
